product_name,product_type,brand,notable_effects,skin_type,price,description,picture_src
Hydrating Cleanser,Facial wash,CeraVe,"Hydrating, Gentle",Dry,15.99,"A gentle cleanser that removes dirt without disrupting the skin barrier. Contains ceramides and hyaluronic acid.",https://example.com/image1.jpg
Salicylic Acid Cleanser,Facial wash,The Ordinary,"Acne-fighting, Exfoliating",Oily,7.99,"A gentle exfoliating cleanser with 2% salicylic acid to remove excess oil and unclog pores.",https://example.com/image2.jpg
Vitamin C Serum,Serum,Timeless,"Brightening, Anti-aging",All,19.99,"A potent vitamin C serum that brightens skin tone and reduces signs of aging with 20% vitamin C and vitamin E.",https://example.com/image3.jpg
Niacinamide 10% + Zinc 1%,Serum,The Ordinary,"Pore-reducing, Oil-control",Oily,5.99,"A high-strength vitamin and mineral formula to reduce the appearance of blemishes and congestion.",https://example.com/image4.jpg
Daily Moisturizing Lotion,Moisturizer,CeraVe,"Hydrating, Gentle",All,12.99,"A lightweight, oil-free moisturizer that provides 24-hour hydration with hyaluronic acid and ceramides.",https://example.com/image5.jpg
